original_text,delivery time_sentiment,delivery time_score,app experience_sentiment,app experience_score,food quality_sentiment,food quality_score,correctness of order_sentiment,correctness of order_score,price_sentiment,price_score,related_ofd
differentiate police malaysia hi guys want share bit harsh experience gotten life malaysia expat living years year last week going condo lobby take order foodpanda gf around pm suddenly one random guy admit police shout one person house go rmo first notice police uniform said yeah aware rules going anywhere take food keep scolding high tone following rmo rules started asking house number ic etc bring ic since thought went lobby settle everything keep prolonging session people watching us create crowd audience seek help security condo sadly cowardly nothing seems afraid take action toward guy admit police defence giving advice said took ur advice thanks wht else u want since condition conducive anymore kept yelling strike chesttochest started thinking might go money solution thingy started losing patience said following safety procedure ur face mask u dont follow physical distance rule striking chestchest u create crowd u see nobody wearing face mask isnt increasing chance people getting infected ur letter duty lost words said u get lost wondering right way tips differentiate real police fake one like money oriented one malaysian police must wear police uniform roadblocks mco duty civilian right ask hisher police id even right take photo police id future reference youre certain person youre talking police real police carry id card times even uniform right ask show heres great article confronted plainclothes police story dont think guy policeman real police wont bother ask house unit number apartment area always roadblock even mco policeman stopped bother ask house unit number best case scenario guy scares people pretending hes police worst case scenario hes scammer potential robber id card still forged god forbid bad thing ever happen always pray safety next time go lobby take food bring phone along record anyone stop saying police calm clearly record face snap picture id shows one asked nicely show id tell maybe double check id police station importantly polite answering questions may use word hes real deal better safe sorry real policeman wont easily get angry bother recorded know theyre legit police station run face id police record dont lose anything hes job guy imposter run feel guy imposter finished recording go police station tell officer someone approached telling hes policeman officer asked write official police report investigation proceed later give copy video recorded let police job know easy get panic approach enforcer calm answer calmly malaysians enforcer always trained nice civilians matter shitty civilians attitude rule simple showing attitude must something wrong claim police officer uniform ask show police card always wait expat ic policeman condo lobby youre menara city one maa pundek apa security guard buat definately imposter contact yr apartment management email let know whats going security guard suppose vetting n help depending response yr building management lukewarm call police station informing ask local strongly believe police act theres information yr action definitely help deter crook cough next time claim police showing badge identification better walk away kind thug getting trouble police maybe tired sick duty maybe get bigger trouble wrong anyway mco going party rather one alone good reason go police come group proper identification would agree confront rule rule obey violated law get trouble critical time joggin awlking alone nott wrong doctor got fine k jogging outside maybe arrogant tried lecture policemen please ensure submission inline covidmco direct submission guideline prevent deleted subreddit ignore apply submission bot action performed automatically please contact moderators subredditmessagecomposetormalaysia questions concerns,Negative,0.9247355461120605,Negative,0.9153957366943359,Negative,0.9226126074790955,Negative,0.9221735596656799,Negative,0.9237383008003235,foodpanda
plea malaysians companies big ceos coos ctos board members bosses please prioritise employees health safety please please love call centre staff front liners possible employees work home even reduced efficiency please let country needs many people possible stay home stay safe employees scared compromised every day leave homes get sick get caught police area theyre doesnt food building theyre isnt clean get sick go home spread parents children medical infrastructure needs people stay home stay safe dont risk spread dont overwhelm medical facilities people sick time people arent going able get treatment need means higher rate death get though sit home big worry company going survive financially able continue providing employees future thats say possible work home even reduced rate let please also time worry stupid customers care one say time prove leader business place employees health safety top priority list us working home comfort safety please give brands businesses break dont bash online slower service long waiting times please understand position everyone right please dont person yelling service agent wait minutes call dont person complaining slow internet cant watch netflix dont person scolding grabfood foodpanda giving good enough deals andor fast deliveries give break la please care fellow malaysians neighbours deleted grab food food panda bungkusit employers must give riders free face masks free hand sanitizers humanity comes first la time read reddit companies like doesnt care employees unless effects earnings masks arent even provided buy running e waited last moment close mco warnings precaution asked us take know us work minimum wage scared losing pay many people willing fill vacancies company registered essential services work safety industry maritime oilgas decided reduce workforce half employee taking every day reduce contact masks hand sanitizers offered free mc taken period recorded still employee hates us cannot afford close vessels platform depending us competitors full force r forced sub jobs r running skeleton crew emails oh god cannot even keep every worker wanting us close hand every client begging us remain operational weve gotten official letters r allowed remain open workers dont want work clients cannot afford us shut employee even went far reported us police came took look around green light us remain open fuck flying fucking shit fucking u people smart fucking tell crisis time like makes realise much company value staff company essential category company worked full force even mco announced days later govener email asking every ceos take mco seriously competitor went partial shutdown yet company allow us work home others bau department new business related definately essential time like still company want us fullforce working higher level go work home thats moreover confirmed case happened office people surrounding get quarantine everyone else come work normally today hod declared work home whole department without ceo approval say hell bear consequences joke manager still expect performance like work office current expectations even found normal day rather reduce efficiency expect improve efficiency instead right im earning extra ringgit every full hour im working yes read right one full ringgit much eyes cant stop sweating course love employee also love money said boss another planet work outside frontline shipping forwarding days feel like org salah pelarian lots pundek mumblings read arrived office open door fumbling ages bunch keys familiar musky hot air surge greets face open office door yr st pundek mumbling cos remember boss tells print customs forms n consignee documents frm office make copies sit yr colleague chair scrolling email consignee attachment mumble nd pundek cos found partial called yr colleague oh separate email lah cari tengok since fond pundek mumblingonly big sighhhaiyaaaaa manage say weii mampuih loo macam nie next time combine everything sent email laaa hihihihi nobody said anything wooo tell boss lah confused ask day meeting dunno hihihihi take care arrr byeee weii pundekkk laaa tried scream phone print couple copies dot matrix printer screaming sound wakes frm yr daydream finally siap semua staple copies lay boss table n also yr colleagues table mumbling incoherently tutup office shuts switches yr boss voice yr head make sure arrr tutup semua nanti bole meletopoooo walked stairs cos wanting risk breathing lift air god knows hw much virus hs multiplied waiting reached downstairs relieved see yr trusty motobike still parked left hour suddenly start panic reaching yr backpocket looking yr keys ahhhh got itwhat relieve one step forward release biggest pundekkkk cry till realize didnt print surat kebenaran perjalanan hd draft behalf yr pundek manager turn around sighhh lift stairs,Negative,0.8903214931488037,Negative,0.8906033635139465,Negative,0.8915195465087891,Negative,0.8906286954879761,Negative,0.8931210041046143,foodpanda
kuching sarawak movement control today marks first day lockdown foodpanda rider advise stay home let us grabfood foodpanda send food want even though supposed movement controlled mcdonalds kfc still full take away orders hey man thanks work time stay safe protect well full mean banyak orang berkumpul one kedai mask without mask mcdkfc workers ask wait car thanks service stuck campus relying foodpanda meals dont forget take care eyyy satok deleted provide mask op heroes wear capes bro thank service stay safe ohhaaaorg kuchinghahayeadah donwload apps food panda kelak mun ada rezeki ada la nemu ini macam death stranding couriers connecting people kojima right along,Negative,0.8582529425621033,Negative,0.8725258111953735,Negative,0.8796592354774475,Negative,0.8804671168327332,Negative,0.8616155385971069,foodpanda
contactless delivery foodpanda buthe touchh bag right extra anal sorry tried order foodpanda yesterday waited hours told cannot contact rider made food instead even effective live apartment every time order go make sure floor front door clean place tray basket since foodpanda drone delivery make sure using online payment banking information place order make money go order tap contact rider dont worry well cancel order noone read part request rider leave food door except couldnt go apartment door raining outside house pandamartwe care well yeah least avoided direct contact maybe also trying avoid rider contracting corona customer good system corona patient quarantine maybe person doesnt know corona corona get rider knows many hundred customers contract corona rider _big brain foodpanda moves stop spreading covid_ well something didnt think please safe wear masks,Negative,0.6043433547019958,Positive,0.4570806920528412,Positive,0.5293360352516174,Positive,0.46968352794647217,Negative,0.49456676840782166,foodpanda
kind hearted foodpanda rider gives food homeless man plot twist ordered taken malaysians fb page restricted movement order know less fortunate people old people could use helps get food please small deed could mean lot see good deed upvote said constantly reminded malaysia amazing place amazing people may always land love compassion beacon others god bless malaysia pray good deeds pour homeless downtrodden restricted movement times kudos foodpanda rider done us proud crai blesssss hope government give treatment aid majority poor homeless states malaysia easily infected cov without proper healthy lifestyle rdaulatkorporat much needed wholesomeness trying times omg wholesome always see posts ig nasty things refreshing change,Positive,0.9392088651657104,Positive,0.9407846331596375,Positive,0.9378553628921509,Positive,0.9491312503814697,Positive,0.9083381295204163,foodpanda
malaymail foodpanda delivery rider dies collision nsembilan malaysia rather unfortunate news although bound happen due riders ride delivery incentives food delivery companies amended reflect delivery time heavily weighted contribution income anything delivery within time youre good deliver earlier time get fixed bonus need cooldown timer last order lapse order receive new order pickup way riders ride safe dont incentive speed much hoping anthony loke something good trackrecord implementing laws keep people safe opinion wont lack enforcement issue incentives speeding riders would speed nonetheless coverage area wide enforcement takziah dan al fatihah kepada keluarga allahyarham nowadays riders like obey traffic lights surprised things like happens always wonder seconds rush contributes lifetime safe guys dont warrior road happen may cost maybe others life also irresponsible family wow rip seremban feb foodpanda delivery rider died yesterday evening collision batu jalan labu kampung lambar near incident occurred pm victim muammar gaddafi jamalludin died spot injuries sustained head according nilai district police chief supt mohd marzukee besar collision involved riders honda wave motorcycle well nissan terrano perodua myvi initial investigations found muammar gaddafi way seremban nilai motorcycle grazed nissan terrano made stop make right turn process rider fell onto opposite lane perodua myvi travelling opposite lane able avoid victim knocked police chief told bernama today muammar gaddafis body sent hospital tuanku jaafar autopsy case investigated section road transport act bernama sad wonder always takes death twelve authorities act something generally accepted happen sooner later news honestbecause good panda rider hundreds mcyclist die month fixed bonus sort bonuses involves early timings allowed think honestly meant question try answer rather modding foodcourier riders known often ride dangerously often breaks law often danger general public may systemic cause behaviour norm rather exception putting death rider news hopefully pulls topic public discourse enough attention given eventually public servants pressured take action something different example accidents involving drunk drivers exposing incidents news enters public discourse police transport pressured take action news earlier police going conduct stops checks drunk drivers whether effective pressure drinking public behave better opt drive remains seen start hope helps people love pushing narratives thru social media guy deemed riding dangerously even police completed investigation food delivery person,Negative,0.8690469861030579,Negative,0.8205718994140625,Negative,0.8479527831077576,Negative,0.8359763622283936,Negative,0.8419064879417419,foodpanda
sign times dedicated parking bay grabfood foodpanda waiting either grempit parking anywhere anyways alphard vellfire euro driver park grab spot good idea imo gotta stay trend block two em cone board apa nama tempat ni mmm menara alpha thatsa good idea excuse deliver floor takde parking la bos hey fellow wangsa majurian ye grabbin spot imma grab mrpunchable,Positive,0.9611533284187317,Positive,0.960527241230011,Positive,0.9624701738357544,Positive,0.9634369611740112,Positive,0.9603958129882812,foodpanda
dekan universiti hantar beg sampah ke foodpanda actually images certainly see foodpanda bags however garbages inside doesnt resemble specifically foodpanda never use food delivery app curious actually dumb dump garbages bags suicidal business maybe sabotage act competitors save environment stop using food delivery app bamf seen unnecessary plastic pad delivery lazada ok boomer wait thought burn less fossil fuel using services need fire v engine instead kapchai save environment could eat somewhere near house andor plan journey properly fossil fuels plasticpaper waste created youre lazy leave house every child student working adult senior citizen v home,Negative,0.8774849772453308,Negative,0.8557978868484497,Negative,0.8610742092132568,Negative,0.8469509482383728,Negative,0.8733722567558289,foodpanda
foodpandas rider food icons get overlapped see something like futuristic robotpanda shopanda kamen rider foodpanda kungfu beast deliver cyberpanda black mirror theme intensifies roam open world kickass panda,Neutral,0.6644817590713501,Neutral,0.8589947819709778,Negative,0.5117449164390564,Neutral,0.49809491634368896,Neutral,0.9222134947776794,foodpanda
man exposed trash littered everywhere malaysian forest included foodpanda delivery bags andy hickson minding business going trek jungle outside gombak look came across hickson looks camera panning record piles trash littered across jungle floor foodpanda stuff thats main culprit says theres whole load foodpanda stuff dumped jungle true enough lying among piles plastic containers trash bags around hickson several foodpandas iconic pink driverdelivery bags people online quick share facebook post many shared disappointed surprised many southeast asian countries known become dumping grounds nations trash malaysia different april malaysian government announced fullforce clampdown illegal plastic waste imported country plastic waste smuggled country goods containers later dumped burnt near residential areas local malaysians become ill regularly due presence stench burnt plastic surrounding homes rivers nearby residential areas also found contain toxic chemicals battle trash continues country across world malaysians part recycling properly disposing trash respective areas like hickson says video get rid trash man,Negative,0.9093912839889526,Negative,0.799535870552063,Negative,0.885388195514679,Negative,0.8567531704902649,Negative,0.8677632808685303,foodpanda
heres people angrily uninstalling foodpanda really none people know uninstalled dont understand uninstalling app utilising service going help riders ppl doare ignorant gullible ppl dont understand world works support foodpanda ss presurring company company lose money turn makes realise need something cant ignore,Negative,0.953168511390686,Negative,0.9335759282112122,Negative,0.9594184160232544,Negative,0.915720522403717,Negative,0.9226702451705933,foodpanda
users boycotting foodpanda company maintains new payment scheme upset riders want burger point like umno pas pointless coalition boycotting want nonhalal food new scheme works efficiency model removing hourly rate increases payment per order deliver earn das said new bonus campaign ran sept oct week reach orders get rm orders rm orders rm top also get rm per hour selected zones deliver orders pm dont get whats wrong new payment scheme deliver get paid rider count saturated might bad food panda dish flat myrhour grabfood knowing people boycott foodpanda intentionally use foodpanda today dinner show support consumer reason boycott baguslah banyak lagi inisiatif lain boleh buat dah ada many things go wrong instance want money deliver food drive faster break traffic laws get sweet sweet delivery count expense peoples safety missed rm incentive work hours week imagine working hours day days still dont reach hours insane work hours day monday saturday get bonus getting paid per delivery means far reckless driving speeding breaking laws blowing traffic lights terrible idea must treated company employees partimers really partimers deleted,Negative,0.9587534070014954,Negative,0.9419858455657959,Negative,0.9495603442192078,Negative,0.9366480708122253,Negative,0.9480331540107727,foodpanda
food riders malaysia much earn month want know roughly since probably wanna rider foodpanda foodgrab maybe share thanks theres video youtuber hazim hamdan showed life fp rider share much earned enough follow traffic laws apparently guessing min delivery rm probably like rm per mointh lol thanks ill check dont use food panda lot order ringgit higher exchange riders responsible obeying traffic laws ill gladly pay cringe every time see rider running red light think riders day dangerous mat rempit nightin perspective road safety disregard violence case comfort going get food price hope safety rider included price well shouldnt take granted comfort necessity bet cut part runs red lights charge lead drivers responsible doesnt lol argue paying per delivery pay hourly encourages dinners actively go slower excarcerbates problem many drivers real solution send solution works places like canada traffic enforcement thats governments problem food delivery companys safety rider one thingbut others road car obeys law goes green happens hit rider ran red light drivers fault rider yep agree might phrased thoughts poorly also motorcyclist always right rule aint brightest im hoping everyone safe road poorly stating riders safety accounted forbut stating careful law obideing really stupid perpetuate myth,Negative,0.5926554799079895,Negative,0.47559383511543274,Negative,0.5154175758361816,Negative,0.5230243802070618,Negative,0.5518258213996887,foodpanda
dr distances syed saddiqs criticism foodpanda mahathir deal shiti see top anime betrayals makes want try foodpanda complete mistake allowing inexperienced unqualified person minister youngest minister ever proves hes job crony jumps support needs comes blunder ask people boycott company personally feels company arrogant minister acting like spoiled child calling boycott someone hurt feelings unprofessional business politics dont mix case government making criticism like discourages people trying new things actually payment system wants relatable know kids always wanna trendy lol smart wisdom soooo basically netorare bad used order late night burgers always arrive hot basically average malaysian minister,Negative,0.9719724059104919,Negative,0.9183728694915771,Negative,0.9724418520927429,Negative,0.9560859203338623,Negative,0.9671267867088318,foodpanda
review mc donalds foodpanda hensem stars want upset downstairs haha customer much price rider customer okay guys lets enter house fuck foodpandan day handsome riders busy boycotting syed saddiq good lookin u gonna naked dare call old fashioned buy food without using delivery service fuck mcd ultra hensem come come boi come marry daughter,Negative,0.8087297677993774,Negative,0.7310130596160889,Negative,0.6851121783256531,Negative,0.807170569896698,Negative,0.9206369519233704,foodpanda
dont want work ok says boss foodpanda quote article companys managing director sayantan das said unwilling sender give convert shifts sender affect income sender want work please give change shifts sender affect lives said foodpanda briefing session hotel kuala lumpur release details new rider payment scheme satan wrong move bro malaysian eyes need unions lmao blaming riders pulak never underestimate collective mat moto eloquently quoted moto friend takpe lets see sky high low western union indeed,Negative,0.9095627665519714,Negative,0.8516437411308289,Negative,0.9280814528465271,Negative,0.8427198529243469,Negative,0.9150819778442383,foodpanda
youth minister moots new law gig wconomy workers foodpanda riders strike workers need protection period called gig economy companies taking advantage employment law loopholes lower operation cost reality without dirt cheap labour subsidies business model would fail look companies like uber still continues make billions losses every year maintaining lofty market valuation insane stupid workers whether permanent contract temp needs protection never see equitable distribution wealth hope youth minister follow words welcome regulations far long since companies lightly regulated think syed saddiq good thing listening workers however time really feel like minister times cant kulasegaran one handle issue case give gig economy workers access wages epf sosco least work giving unions power country gods sake support realise everyones food delivery cost go im fine everyone else lol wages go cover costs freelance contract work higher rates permanent jobs since workers need cover fees rate competitive take another gig total compensation hires cover epf salary goes accordingly even moreso since requires extra processing need regulations regulations needed ensure companies dont abuse labour live society hour work week abolition child labour result government regulations cannot trust companies humane things decreases profit margins also noted right foodpanda workers longer paid wages instead paid solely deliveries means paid much less even regular workers lowering food pandas rates might encourage competitors lower pay rates well taking another gig really viable meanwhile university start advertising hiring using total salary value includes taxes like advertise rm includes employer epf socso foodpanda raised rates per delivery eliminate fixed income drivers angry sometimes wait hours getting delivery thats case article speak people left jobs part time paid less would leave another job taking another gig doesnt necessarilymean going competitor unskilled jobs shortage blue collar workers fill bringing migrants instead,Negative,0.7816147804260254,Negative,0.6571273803710938,Negative,0.7261714935302734,Negative,0.6980735063552856,Negative,0.7818331122398376,foodpanda
