original_text,delivery time_sentiment,delivery time_score,app experience_sentiment,app experience_score,food quality_sentiment,food quality_score,correctness of order_sentiment,correctness of order_score,price_sentiment,price_score,related_ofd
normal bought popcorn chickenfrieslemonade pop meals via foodpanda rm fries portion barely scoop em small money couldve bought nasi lemak ayam mamak get moderate portions thoughts yeah never buying restaurant whatever ever pop gone hill last years used good absolutely shit pop meals scam pop meals downhill since rebranded dahmakan bit pricey thought food tasted good portion reasonable mamak way man pop meals skimping food bro like wtf fries portion bro could get kg popcorn chicken cook minus seasonings though normal actually realize mcd way value comes drink pop meals blacklist might well buy frozen food put inside air fryer even eat repeated occassion dude looks depressing imagine get ordered chum bucket tf,Negative,0.8464376926422119,Negative,0.7989945411682129,Negative,0.8594534993171692,Negative,0.7652654051780701,Negative,0.9289720058441162,foodpanda
foodpanda bicycle rider question greetings looking specific insight foodpanda bicycle rider anyone inside knowledge works first hand experience would appreciated referring foodpanda riders specifically ride manual bicycles electric bicycle scooter seen question works exactly terms foodpanda side assign jobs bicycles seeing job given far would impractical pick drop order timely manner seeing bicycle exactly designed travel fast long distances reason asked pondering try wondering works commiting hi used foodpanda walker mco need apply foodpanda walker option applying yes recommend youp get bicycle electric scooter delivery walking coverage radius small quite tiring heya rmalaysia currently conducting sub census since last one back please click thread answer survey collecting responses th march till pm rd april bot action performed automatically please contact moderators subredditmessagecomposetormalaysia questions concerns,Positive,0.7219277024269104,Positive,0.6756970286369324,Positive,0.6296730041503906,Positive,0.7978652119636536,Positive,0.6269800662994385,foodpanda
foodpanda wants beg refunds know still lot foodpanda users despite pleasant experiences things go wrong orders sharing post tip everyone aware current situation things especially new users doesnt clue goes list dont refund stock items paid cash vouchers lazada shoppee system sees maximizing voucher value loss profit example buy bottle nescafe coffee bottle stock stock considered burnforfeited original cash voucher wont refunded next time want order make sure go store get confirmation store manager whether stock first order anything customer service non existent impossible get live chat live human agent suspect running ai chatbots spew scripted replies close ticket within minutes less past still possible get refund human agents mindless bots facebook admin suspected chatbot well admin always online replies postscomments multiple language support scripted replies promptly capable deleting comments also ban users critical services well order words negative posts facebook would deleted would banned damage control continously comment poor services reporting kpdn tribunal worth due small claim amount still attend tribunal hearing office incur time cost taking leave work parking petrol transport charges etc know would ignore kpdn threats customers feel free continue hereband add post bad experience objective remind everyone waste anymore time using services wouldnt even care beg refunds raise blood pressures perception much customers losing doesnt even make dent profits stop using foodpanda shoppeefood currently best market deleted app right pandemic faced various issues follow emails emails refunds include many justifications mistake havent using almost years however live klang valley alternatives outskirt folks app main food delivery much grab also issues sucks lesser fp app sucks promo sucks cs sucks ordered dominoes app says still way hour got fed waiting turns app frozen driver delivering screen even refreshed called dominoes didnt end delivering food went actual store shouldve prob drove first place wanted surprise sis bro law since exhausted work walla food back kitchen workers like thought cancelled still pick soo confused pissed knew id getting cold ass pizzas took rm refund sounds delicious didnt take kept calling foodpanda got refund time first started working couldnt get cc using debit deleted app refund never gone back fp worth years ago order food foodpanda option item stock default setting remove order also choose call cancel whole order obviously call option best choose cancel whole order voucher returned foodpanda wallet granted use foodpanda food delivery im sure option grocery delivery also usually use chat feature problems delivery food spilled missing items etc usually get good resolutions mean usually refund cost food item im asking food cost take voucher use next orders usually ask vouchers refunds credit card money already account voucher free credit card chargeback successful hahahah facebook definitely automated issue real human dealing issue sadly company nowadays want cut cost uses ai replace customer service use panda bit cheaper grab dont pay transport back dont deal makcik membawang dan orang membebel plus browse long like without trouble panda really shirty get around cash refund opting cash payment qr online bank transfer rider panda cant take money never gave st place foodpanda worst refund took days grab misi instant refund credited account wallet foodpanda refund backs bank took longer dang never heard fam use fopanda near daily never problem drinks spilled wrong food item sent always got refund happened wed get voucher refunds usually back payment option withing minutes pay tng ewallet tho days ago got deal marry brown instead lucky plates got nasi lemak talked chat bot mins got rm voucher though yeah ai chatbots arent great,Negative,0.9517671465873718,Negative,0.9498816132545471,Negative,0.9494860768318176,Negative,0.9502212405204773,Negative,0.9509754776954651,foodpanda
cancelled order foodpanda still didnt get refund pretty sure falls kpdnhep authority mediate update contacted via insta page went front back bit tried ask wait days told wont wait raise dispute thru kpdnhep instantly folded refunded foodpanda policy stupid fuck refunds online payment orders right refund cancelled order vendor yet accepted order still decide cancel order accepted vendor understand refunds whether whole part issued forfeit delivery cancelled order honestly dumb pretty much understand vendor accepted order even food isnt made money threes nothing unless threaten food panda legal actions context originally wanted order aw dinner got back home work cancelled seconds since friend offered take dinner noticed tng money deducted realise foodpanda gave hours deciding would raise support case live agent realise removed option connecting live agent instead shove send us enquire get back soonest possible instead resolving issue met ive tried contacting email get similar copy pasta response way get back money im college student already trying make end meet source income part time job bare minimum wage foodpanda refund slow get money back around days need keep calling customers support think query everyday issue preservere pray get decent customer service executive care enough help panda always like get bad cs refundmin refund must got storyi got refund foodpanda grab everytime especially fp lightning fast would process like get started kena panda like u cancelled coz ordered diff things coz initial order took long tried call many times said cant refund apparently seems like people answer junior told blanket statement cant refund escalation got money back case report online kpdnhep quick ways believe whatsapp line email address complaints id use email route cc foodpanda make squirm sweat whatsapp easier go ahead portal make complaints whatsapp link email contacted via insta page went front back bit tried ask wait days told wont wait raise dispute thru kpdnhep instantly folded refunded foodpanda policy stupid fuck refunds online payment orders right refund cancelled order vendor yet accepted order still decide cancel order accepted vendor understand refunds whether whole part issued forfeit delivery cancelled order honestly dumb pretty much understand vendor accepted order even food isnt made money theres nothing unless threaten foodpanda legal actions,Negative,0.9062853455543518,Negative,0.8873139023780823,Negative,0.895095705986023,Negative,0.8677662014961243,Negative,0.8911869525909424,foodpanda
foodpanda vs grab vs shopeefood using shopeefood wanna buy short range vendor due delivery voucher normally spend rm lunch dinner pros need spend rm delivery voucher cons delivery voucher insufficient cover far vendor delivery fee foodpanda wanna buy short medium range vendor delivery voucher panda pro voucher average spending rm lunch dinner pandapro voucher rm unlimited rm x voucher x cons sometimes hour delivery time free delivery spend rm grab panda grabfood pro used suck zero food voucher give rm voucher orders rm average spending around rm lunch dinner grab voucher limited rm x cons limited voucher grabfood pro delivery discount insufficient cover far vendor delivery fee idk name grab food unlimited voucher limited,Negative,0.791804313659668,Neutral,0.7753902673721313,Negative,0.6536463499069214,Negative,0.4592857360839844,Negative,0.4983270764350891,foodpanda
foodpanda rider spilled drink refund ordered two drinks foodpanda foodpanda rider took picture drinks delivered one fell customer service said refund claimed tried contacting didnt receive anything insisted unreachable closed investigation picture rider holding spilled drink right spill would holding spilled drink take picture say want grab least customer service less rigid grab wouldve offered refund foodpanda merely copy pasted response rise dispute keep complaining dont let close ticket complained several dozens times gotten kind compensation almost might try mentioning kpdn next time issue amen similar thing happened one ordered item missing pack sealed complained fp denied saying evasive shit called shop back answered stopped using fp immediately real twats dont mean make generally stop using food panda cuz shitty drivers help services report change food delivery apps find astounding people still use fp absolute crap company report used student shah alam road get dorm huge pain ass food delivery riders water theres spilled drink experience older riders usually tend offer compensation younger ones didnt even mention anything open order lmao mfs crazy update attached screenshot kpdn report made started new dispute immediately offered refund imgemotet_qhb theres actually people sub claiming fp cs isnt problematic made wondered theyve improved years post showed old nonsense never problem refunds fp fact complaints fp grab says something ditch fp grab even though im afan grab cs know wont contacting much im fp,Negative,0.8931379318237305,Negative,0.7464896440505981,Negative,0.8786236047744751,Negative,0.8039466738700867,Negative,0.8978162407875061,foodpanda
shoutout amazing grab foodpanda abang riders want give shoutout two abang riders near batu tiga today two separate chaotic traffic junctions lights completely two abang riders one grab one foodpanda stepped heroes without hesitation became traffic controllers directing vehicles calm systematic approach dont know long watched minutes working tirelessly ensure everything ran smoothly didnt chose help made huge difference heartwarming see dedication effort help reminder good people massive respect abang riders true unsung heroes day ps sorry abangs snapped handsome photos u see dislike pls let know n take post huhuhu bad immediately rained know bc live batu tiga rarely rains rain heavy kind bros need zombies come bro pink looks like would good zombie killing leader zombie herder lv trafficmaster passive ability lead zombie hordes zombie jam letting kill zombies one one,Positive,0.8726339936256409,Positive,0.9071688652038574,Positive,0.8890034556388855,Positive,0.8648304343223572,Positive,0.8801602125167847,foodpanda
foodpanda fake star ratings wanted put cos fuck foodpanda management almost every store star got scammed eating terrible food thats issue issue fuck foodpanda management able honest business practices hope go bankrupt rule never trust star ratings internet people still take foodpanda delivery fee insane back covid okay getting grabfood grab sometimes even hide really bad review resturants show rate click resturant details see star review almost impossible complain bad food require photo dont accept evidence fck prove food funky spoil taste photo live chat anymore consumer rights annoying cant trust app dumb decision make much harder choose order shocked unable search keyword free google maps reviews manual sort shows clearly incentivized giving free food review sure point foodpanda way outrageous stating observation charge topping grab wallet credit cards right,Negative,0.9886094331741333,Negative,0.9886764287948608,Negative,0.9879510998725891,Negative,0.981090247631073,Negative,0.987357497215271,foodpanda
issue road pandamas ampang area assalamualaikum picture last picture take googlemap time indian prayer okay well want tell september indian prayer area prevents main roads pandamans apartment build khemas place prayer matter please wise mature organizing key road okay thats first problem big case time carrying foodpanda time road found traffic jam bit crowded wanted tell story go place prayer say road suggested people control traffic traffic meant branches branch road one way important states told used good tone genttle suddenly indian friend got approached invite say haa u followed another indian friend said long stay answered month like one friends answered u month blah blah blah prayer place prayer prayer place quiet okay u want ask good asked path proposal respond like way started conversation alone anger state tension say offended insulted ridiculed mocked underestimated religion time record didnt know something near kept going times take pictures area,Negative,0.8311505317687988,Negative,0.7069266438484192,Negative,0.8257896900177002,Negative,0.8282981514930725,Negative,0.7975776195526123,foodpanda
china rom phone disadvantages malaysia hi im planning buying oneplus ace available china romthe price quite affordable disadvantages using china rom phone malaysia signal issue also heard apps like foodpanda grab cant use china rom phone say app supported country cant change region malaysia phone settings avoid happening anyone using china rom phone malaysia please leave comment post indeed need answers little chance may get phone use cdma protocol cannot used malaysia need check whether phone use gsm cdma ive checked gsm cdma mean usable malaysia normally one two time totally different chipset check bands well support bandfrequency used malaysia im really professional kind thing im interested learning search google oneplus ace cdma gsm open top website thats show said gsm cdma shown picture technology part show gsm cdma thats thing u ask check earlier right check wrong thing product page website always shows options actual phone need certain specific situation china usa remember correctly two countries cdma gsm usage need ask seller phone know information yes need confirm device buying uses tech band used malaysia refer site basically need confirm gsm g umts g phased malaysia already lte g andor g bands note different network maxis digi uses different bands usually issue since device support bands tech bracket except g tech still recent,Negative,0.7457971572875977,Negative,0.7482045292854309,Negative,0.7259754538536072,Negative,0.7496173977851868,Negative,0.7017746567726135,foodpanda
diner furious foodpanda giving automated reply maggotsinfested food complaints users often report submissions site ask us ban sensationalised articles rmalaysia oppose blanket banning news source readers responsibility skeptical check sources comment flaws help improve thread linking media verifies questions articles claims link could help readers better understand issue find evidence article title false misleading contact moderators review bot action performed automatically please contact moderators subredditmessagecomposetormalaysia questions concerns trashpanda stole food refused acknowledge ridergps problem multiple times ignored request refund hours dead hungry middle night hope go bankrupt never using foodpanda ever ordered twice orders arrive minutes late occasions crispy fried chicken turned lembab chicken first maggi goreng turned maggi lembab second also horrendous support even customer support hotline,Negative,0.9604589343070984,Negative,0.9061599373817444,Negative,0.9559267163276672,Negative,0.9308655261993408,Negative,0.9590640068054199,foodpanda
got phone number someone else owned hi guys title suggest im new malaysia student given number maxis someone else owned hence created profiles foodpanda shopee number understand need shopee buy basic electronics amazon customer service shopee helpful delink users old account really frustrating way someone support ideas perhaps easier get new number cant use email shopee try lazada,Negative,0.8958972096443176,Negative,0.8079314231872559,Negative,0.8979629278182983,Negative,0.8888871669769287,Negative,0.9103638529777527,foodpanda
grabfood customer service bad ive using grab food delivery service cannot stand service like ago placed order cancelled right restaurant never got refund wont anything accidentally order something wont let cancel tell use help centre well sucks everytime brings ai chat doesnt understand anything would switch another service none foodpanda charges order bad experiences apps grab definitely takes cake ordered dinner family rider refused pick fixing bike refused cancel someone else pick cant cancel cant contact restaurant cant get touch support without long wait time eventually restaurant closed food lost finally get grab offered rm compensation rm bill waited hour hungry kids eventually given sandwiches told shove pathetic excuse apology stopped using service much possible boils lack regulationsoversight government many e companies free reign deem responsibility towards customers much choice best foodpanda second grab shopefood worst oh man hate grab much one worst customer service ever come across definitely worst malaysia ninja van worst least done alot improve past year ordered grab food delivery obviously eaten driver drink cup half empty missing items security seal broken messaged grab assured refund grab charged double instead refund course ai bot help centre useless fbinsta messenger reply help centre reply finally today week posting grab social media links got reply saying matter referred another team hopefully reply week wtf hard get refund obviously wrongly overcharged order queueing system suchs orders jammed centre sent merchants kitchen maybe write management complain small tribunal court foodpanda charges like service tax processing fees soo save money using grab thing refund cost meal going tribunal wont net much since hard quantify value inconvenience ooh full refund already aiyah sudahlah expect riders mantheyre rempits dont expect butler service lor long money back fine waited hours stupid kfc delivery using kfc app got fed left dinner later rider comes call ignore use cod chicken cash lol take chickens back kfc,Negative,0.9814724922180176,Negative,0.9785006642341614,Negative,0.9794369339942932,Negative,0.9776802659034729,Negative,0.9822339415550232,foodpanda
lets hear suggestions motorbike culture malaysia recently came across another video abang rempit running redlight deservedly getting life threatening accident say deserved yeah fafo zero sympathy led think many times swerve car lane idiots reckless care nothing except im afraid love car scratch hit car ideal cant pay damages anyway im making little post right ask sort suggestions might hinder sort behavior im talking lawsrulesroad legislation im also fully aware basically chance gets implemented id like hear suggestions boring rainy day work ill start anytime dashcamroad cctv catches perpetrators running red lights andor ridiculous shortcuts take may put others risk license revoked work grabshoppeefoodfoodpanda etc anytime full proof video submitted lose job instantly work represent company think liable staff job feel food delivery platforms apply tactic would see huge decrease idiots thinking get away whatever want lets hear ideas think mainly got law motorcycle gets accident car regardless whos actually fault car driver lay ah yes contribute self bashing choose ride suppose biggest problem would baseline ethics everyone tidak apa cincai attitude problem never go away lol jk enforcement alone much really even begin change cultural norm even getting people stop littering challenge notice went uni even ruralish state like terengganu one ran redlights came believe grabfood foodpanda became thing foodriders first really run redlights plenty people followed okr going work daily motorcyclist run redlights everytime take side road genuinely cultural thing ride daily back work ran redlights yeah one front house rare like time culture really monkey see monkey people tailgating emergency ambulances like idea taking away licenses caught camera another culture enforce though itd nice way incentivise waiting light make waiting tolerable better traffic management everyone access mobility totally understand income education linked country currently engineered build rempits im sure stick carrot method enough prevent forming habit maybe law abiding rempit messiah show right path one day one thinks mat rempit culture dangerous motorbikecars way malaysia natural selection op searching way decrease stop behavior sadly op right change rules get enforce run redlight accident car get compensation anyway based experience polis damages cause claim money refused pay polis dont act video even like seriously malaysia way life sg make motor cycle license cheap attend hard pass sadly whatever idea propose matter good never enforced due political suicide imagine protest riots street something prevents motorcyclist langgar red light see bang agree one comments came frequently grab food food panda bike delivery started kill many jobs sake saving lives think replacing bike delivery drones instantly solve channel redundant people work something else unfortunately practice racialist political system every problem seen racial lenses even know fix problems law breaking motorcyclists little political law breaking motorcyclists identified coming particular race means politicians selfproclaimed champions race defend till cows come home every time anyone complains seen enemies race,Negative,0.8771357536315918,Negative,0.8489527106285095,Negative,0.8683152794837952,Negative,0.8766823410987854,Negative,0.888256311416626,foodpanda
beware tng rm rm voucher pack scam voucherpack_june_webbannerpng fell believe misleading promotion touch n go tng ewallet want warn others waste money heres happened deal tng running ad ewallet app promising rm worth vouchers rm sounds amazing right thought quickly paid rm reality paying received eleven vouchers heres catch wasnt clearly communicated upfront minimum spend requirements voucher requires minimum spend usable example rm prepaid voucher requires rm topup rm foodpanda voucher requires rm purchase rm carinsure voucher requires rm insurance premium short validity periods vouchers valid days making nearly impossible use unless already planning spend lot within short timeframe misleading marketing initial ad conveniently omits crucial details revealing deep terms conditions kind hidden information feels incredibly deceptive preys users looking good deal final thoughts really frustrating see tactics rm might seem like much principle tricked really stings stay cautious everyone mid year mega voucher pack touch n go touchngocommy could lodge complain kpdn deceptive marketing tactics stopped caring tng points vouchers scam always stock rm donation tng excusing tg anyway keep mind read tc next time checked promo app tc provided link listing available vouchers minimum spend requirement latin maxim called caveat emptor ie let buyer beware enter shopee rm cap fu bigger ads larger scam scheme ya opimgemotet_qhb since tng trusted theres free lunch sky similar entertainment coupon back us like one office episode oscar figured need spend exorbitant amount money book worth spending requirements fair dont expect free money short validity periods kills definitely fair give year probably use use early buy,Negative,0.9685925245285034,Negative,0.9681451916694641,Negative,0.965013325214386,Negative,0.9694830179214478,Negative,0.9673937559127808,foodpanda
foodpanda serious right neow im pissed wtf max delivery fee ive seen peak hour around rm words fuck foodpanda location kedai kat hatyai ke tu grab foodpanda etc work way first price cheap lure people successfully monopolize industry hike price extent doesnt make sense anymore back spend rm grab home nearest commercial area costs rm peak lol u order klang issit bucks delivery food deliver lorry right front table include tolong suap special janda motor diesel guys gotta remember life food delivery services likely bug dont panic theres still grab food delivered doorstep luxury normal everyday service,Negative,0.9334409832954407,Negative,0.8012856841087341,Negative,0.8767344951629639,Negative,0.7150152325630188,Negative,0.9697073698043823,foodpanda
