original_text,delivery time_sentiment,delivery time_score,app experience_sentiment,app experience_score,food quality_sentiment,food quality_score,correctness of order_sentiment,correctness of order_score,price_sentiment,price_score,related_ofd
year ago opened fnb business selling fried chicken asked rmalaysia things customers would like street hawkers justify buying regularly month would last month business heres story link previous post warning gonna long ass post head tldr summary background feb opened small business selling fried chicken renowned brand johor lets call mhc brand dead giveaway know paying certain amount rm hq got right sell mhc product hometown ecstatic researched brand awareness market demand months convinced business financially viable manage ps well product price place promo also helps years experience fnb business prior venture game plan ultimate plan hand business brother finished training run also planned expand locations years therefore locations handover another sdn bhd still manage therefore took salary locations lower cost purchasing raw materials maximise profit margin finally give salary paint picture one location hits minimum monthly sales generates approximately rmrm net profit locations rm net profit execution based ps marketing weve encountered product hq products limited proteins carbs drinks hqs korean sauce game exhaustingly weak viscosity isnt right taste isnt right agents cant tamper prevalent complain customers blackened chicken bones hq dismiss complain completely price hq position product midtier options fried chicken agents sell roadside making us vulnerable comparison cheaper options place sales increases whenever join events festivals outside usual locations listing products foodpanda grabfood must without fail platforms represent total sales think decent since operating outside major city promo hqs promo effort disappointingly minimal ads spend whatsoever digital traditional space reliant tiktoks generous organic reach unsustainable weve done product add rice fries drinks options give discount voucher every time customers complain hqs weak korean sauce see price cant tamper price present midtier options accordingly roadside stall store freshly fried chickens proper food warmer cleanliness decent despite best effort see place move permanent location provided majlis daerah spacious rent relatively cheap longer cram staff van unfortunately deal cat ladies makciks feed every stray cats passing premise result premise looks feels ghetto fuck join events festivals manage logistics always join foodpanda grabfood promo deals one thing dont participate one vendors pay want rank higher listings promo rmmonth allocated meta advertising without fail result addition rice fries drinks options increase sales significant around customers didnt even use voucher gave sales peak school season decreases school holiday period however q best quarter due lot catering requests school teachersparents jamuan celebrating end school year height kfc mcd boycott sales reflect significantly feb feb recorded losses two months april ramadan may raya month median net profit feb feb rm average loss rm sales couldve better vendors avoid openingclosing business erratically vendors open premise bustling customers close sales got affected last straw silly adhering ps marketing instead ps marketing completely underestimate fifth p people staffing major headache since day ive staff went mia midshift stole cash register showed late macam kedai bapak dia close shop early macam kedai nenek dia headaches im sure every employers thats worst worst mix family business shouldve let brother near business family members understand know keep things professional mix family business dont dont mix family business otherwise theyll treat everything said personal like youre get business ive never quarrel brother mom never deal us arguing point beg us stop crying arent speaking terms drop stuff shop act like invisible mom asked punish brothers lack professionalism workplace coincidentally coupled one dependable staff tendering resignation last week straw broke camels back family favouritism aint thing clearly family cant separate business family affairs ive decided close business fearing would make things worse family brother always find another job plan hand business realized pipe dream opening locations well life stood way learned fnb cant managed halfheartedly gotta go dont moneymaking avenues wouldve probably cut ties brother roll sleeve keep persevering dont youre interested open mhc business remember golden rules hire staff every pcs fried chicken sold daily youre selling consider hiring another staff make things less chaotic run meta ads availability catering target school teachers parents months school year ends always reject staff candidates criteria unmarried mentions part time even bring family members applying hisher behalf primary customer avatar working malay mothers though shortlived ive regret barring family drama decent business venture gained nothing financially business managed give two staff competitive salaries well minimum salary regulation without migrate kl year tldr opened fried chicken business family member underestimate importance staffing close business family situation gets worse learned lesson bonus pics first location roadside moved permanent location thats recent bazar ramadan expecting one lessons learned never get business advice rmalaysia joking aside ay bro may come stronger wiser good overall one best pieces working ive read long maybe reddit many nuggets gleaned mucho gracias wish better outcome next venture op ive fnb business decadebuilt zero must go order succeed family part goes every business dont mix business family thanks sharing experience op really appreciated stories really need im open business kuching selling beignets guess gotta give wish luck curious brand people touted local brand alternative kfc finally decided give try recent bazar ramadan chicken bland sauces bland like salt seasonings like op said sell chicken sauces price cheaper kfc batter ok guess anyways best op ill stick kfc mcd time retail biz owner almost decadesppl ask whats important usually thinkmarketingor salesetc answer hr boss important job manage hrkeep staff happy keep managers happy everything else easy sounds like learned important life lessons first hand best remaining ventures frayed family ties always management comes business u manage right smooth humans complicated things manage always pain ass deal lastly getting familypartnerfriends involve big nono agree unless brief business concept n mindset understanding business operations could try hearing n person disagreement doesnt buy concepts forget well done man u u could business easy run youre person manage everything including staff n finance huge dilemma n pain ass based kv almost mhc stalls kv googled would love buy fried chickens close stall good im really sorry hear situation wishing best next endeavor,Negative,0.8263671398162842,Negative,0.8248112797737122,Negative,0.8261815309524536,Negative,0.8252633213996887,Negative,0.8257365226745605,foodpanda
item ordered food panda isnt labelled nonhalal last week friend went new sunway donquixote store bought ajinomoto gyoza giving glowing review got home thought get one ajinomoto website mentions get one aeon one near ordered one food panda since get cheaper vouchers came different packaging friends came thailand halal logo even soy sauce ingredients mentioned alcohol bit digging new halal ajinomoto gyoza friend got launched november mine manufactured september went aeon checked nonhalal section said take refund issue food panda asked food panda customer help chat said use halal tag search function doesnt exist ai said refund ineligible since received ordered item asking thoughts help apa susah kawan give friend eats nonhalal friend pandai treat meal ajinomoto throw dustbin anywaythat thing trash want get money back always sell non perishable food sure carousell accepts selling food ingredients try use socials sell yea honestly making mountain molehill case foodpanda ensure buy dijamin halal anyway alcohol blanket haram since jakim accepts maximum alcohol content final product op kalau waswas jangan makan habis cerita _what friend speak j_ haha dont friends eats nonhalal none thats close anyway uncle roger disappointed way life im food dustbin kinda moot yeah tak makan sitting fridge wasting space money know alcohol soy sauce chicken might prepared muslim way pain take account foodpanda label nonhalal items case hoping make money back since didnt get eat gyoza wellon side maybe auntie helen like kind dangerous life,Negative,0.9175201654434204,Negative,0.8993889689445496,Negative,0.9369791746139526,Negative,0.8634167313575745,Negative,0.9126169681549072,foodpanda
foodpanda longer sale negotiations terminated soyacincau last year reported grab may look buying foodpanda business delivery hero se several months negotiations talking delivery hero decided terminating negotiations selling foodpanda thank goodness grab ass meanwhile fp rider beating shit outta pp till someones dead think make money taking cut new service pandamani vengeance whip panda punch,Negative,0.9388017058372498,Negative,0.8419722318649292,Negative,0.824673593044281,Negative,0.7878018617630005,Negative,0.8095988035202026,foodpanda
rate rider grab foodpanda shopeepay much want gig work weekend since current job cant handle nowdays economy heard rider rate gone like really bad im currently live pj area work kl want find provider work freehouri heard fp schedule dont want stick schedule help please tq,Negative,0.9404284954071045,Negative,0.84872967004776,Negative,0.8876363039016724,Negative,0.8592575192451477,Negative,0.9562053680419922,foodpanda
popular malaysia telegram channels follow im looking legal ones ah ive found kl weekend plans lots ideas things weekend food promos foodies new places eat stalls discounts promotions like free food rm stuff makan murah places eat discounts bahasa grabfood rider malaysia official foodpanda rider malaysia lalamove riders malaysia malaysia pc gaming community government financial aids ministry health malaysia malaysia telegram channels follow daddy ash,Neutral,0.5163789391517639,Neutral,0.5021000504493713,Positive,0.5316941738128662,Positive,0.5200688242912292,Positive,0.5352414846420288,foodpanda
thoughts shopee food recently purchased shopee food first time experience delivery bit slower compared grab seems options discount bit cheaper sales period far ive tried grab food panda im slow adopt new apps like seems okay general malaysian thoughts shopee food app best moment shopee food app stupid hard navigate though maybe need learning curve wanna get sense worth commit anything im sorry sounds like ad shopee food isnt ive brought tribunal court shit delivery twice always used shopeefood cheaper use coins two expensive lah shopee food used allow combination vouchers food discount freediscount delivery made mad cheap voucher applicable straight shiti understand rainy traffic holiday drivers found drivers wants take order sunny day traffic yet cant find driver also wait hour cancel automatically cant find drivers enough vendors shopeefood area pricing different maybe rider rider know wear food panda cloth bag ordered shopee food food panda arrive use multiple platform choose voucher cheapest option use grab shopeemostly used grab delivery fee cheap compared shopee mcdonald cost ringgit delivery shopee ringgit example lah aiiyoo shopee dominant discountvouchercant deny tracking ordergrab mewhen rider move follows along shopee skip skip route although could closeandopen app track accurately cheaper become big jack price like two services time hopefully another upcoming service cheaper attract customers true cases agree grab ever since mco huge rip delivery fee increase randomly discount really discount mark becoming insane bucks fried rice something seems issue area well im also tired grab vendor ive using last years much changed ive checked except mcdonalds guess vip client everything else crazy markup like favourite chinese store expensive grab said shopee doesnt even store lol,Negative,0.8805029392242432,Negative,0.8113130927085876,Negative,0.8470919132232666,Negative,0.8095338940620422,Negative,0.8617576956748962,shopeefood
food delivery regulars grab food panda etc actually cheaper expensive disclaimer im new food delivery yes im super late scene trying understand hear people heavy users saying cheaper order decided try mostly using foodpanda see jacked prices everywhere like mcd example need add delivery fee compared buyatretail expensive see vouchers reduce price meet threshold maybe subscribe panda pro reduce delivery fees right even find prices arent much better compared dinein sure save time parking convenience pure cost meal see much difference generally expensive esp run vouchers missing trick secret method get cheaper price delivery heavy users get reward points ps notice dominos seem offer good pricing compared actual store price like dont hike much else actually used cheaper years ago crazy promo operating loss build customer base nowadays expensive dont subscribe even opt subscription actually smart purchase ensure ends cheaper eg breaking rm order two apply offcapped rm twice youre mainly paying premium convenience food coming rather going food taking account things like fuel price parking times definitely expensive whatever options eating food place say cheaper apply necessary vouchers order group theres also hidden payment conscience order caused rider road whatever weather distance many red lights passes eat speaking frequent grab food sometimes food panda user paying premium exchange convenience whether convenience worth hikedup price entirely decision add order frequently even order multiple items per order often order meals parents order costing rm average vouchers also conditional eg minimum order amount rm limited selfpickup also use accumulated grab points offset cost sometimes thats onceinafewmonths occurrence nothing shout really grab points almost worthless barely earn points days theyve revised times earning mechanics ordering via grabfoodpanda cases expensive need actively compare prices inshop grabfp know diff may instances cheaper vouchers hot deals etc common anymore days rather go tapau unless need convenience missing trick secret method get cheaper price delivery heavy users get reward points chaotic differs shops go touch grass figure ones cheaper roughly apply rule restaurant well without delivery orders wont bother reduce deliver menu price attract customers dont think last forever though grab example running loss decide stop trying attract customers delivery price always expensive think general rule restaurant prices delivery apps higher instore dont know places mostly order regular shops also frequent person yes dont try many different things im boring usually rm including delivery higher either app grab fp go buy use one grab unlimited vouchers order still rm expensive grab compared go youre heavy grabpay user means actually reloading ewallet paying accumulate grab points use offset cost food havent done calculation dont think points cash ratio great cheaper companies fighting competition gain marketshare lots funds offer enticing promo codes campaign ends things arent cheap theres always markup food price top high delivery fee grab unlimited member worth order least ppl discounts selected food vendors worth convenience long term reason cheaper restaurant makes less delivery order add delivery fee expensive waiting food things like watch tv,Negative,0.915351390838623,Negative,0.9050695300102234,Negative,0.9132755994796753,Negative,0.9074764847755432,Negative,0.9140526056289673,foodpanda
grabfood foodpanda prices title says reference stay around kl area recently far first time ive experienced hoping someone else could explain like weeks since holidays grabfood practically either unavailablelike month opened grabfood lot choices delivery prices insane foodpanda isnt much better availability delivery prices insane someone please kindly explain whats going understand also noticed pestapanda voucher code doesnt seem working agreed mostly eid ive also seeing lot false prices delivery ie showing rm page rm checkout even saver option sure bug still really annoying duhh due raya eid holidays notice previous latest update grabfood slowly removing vouchers grabunlimited eventhough paid extra privileges holidays rain pandapro perks becomes worst haihhh festive seasons need look hari raya cny time week prepare inconvenience lot people including riders took holiday way wesak day even next week malays holidays insane use shopeefood dude way discounts vouchers lack riders thing happened area shops took longer prepare food due lot orders lack riders makes delivery lot expensive usual,Negative,0.9814520478248596,Negative,0.9746474027633667,Negative,0.9770569205284119,Negative,0.9694533348083496,Negative,0.980453610420227,foodpanda
whats good monthly allowance budget university student malaysian university student lives hostel even weekends needs money food whatever eateries university provides deliveries restaurants via grabfood foodpanda etc convenience store maybe even needs money laundry maybe need buy equipment studies say need camera new computer whats good budget student get entire month including tuition fees leisure activities unforeseen events requires money man way teach math school useless provide real life questions like assumptions put excel spreadsheet adjust according circumstances hostel room single person rm rm sharing rm luxurious options food rm meals days rm filling snacks milo biscuits budget rm optional occasional feast rm total rm utilities wifi rm electricity water rm mobile data rm total rm optional transport parking rm fuel rm refuels per month rm total rm round rm safety total low rm mid rm high rm might missed something put excel sheet edit something comes mind savings adjust excel sheet expenses pop reduce expenses income enough support assume youre asking kid remember consider kid travels back hometown meet yes need consider budget maybe increase bit kid leeway spending ask report spending adjust spreadsheet youre worried kid bazir use spreadsheet find suspicious spending budget using highest expected spending always budget enough dont budget expecting skip meal something got allowance monthly save laundry parents house going back weekends occasional gas refill extrapolate roughly k say location bangi food alone rm day bit leeway go bit higher lowernot less rm possible eat times day make sure eat heavy enough lose gain weight basically buy food closest uni eateries pay first meal grab food second meal smart pick food grab get bang buck portion wise thats roughly rm month things like leisure stuff necessary self maintenance stuff included maybe together hah like enough cook food live including rental lives nilai sep jan rent bills utilities around per months cooking deleted first remove one purchase monthly allowance budget phonecameracomputer depending lifestyle food account majority expense since hostel assume paid beginning semester break simple categories food x x rm phone bill rm entertainment cause uni let fun rm rmk month good amount used get monthly stipend uni enough granted live parents sure lifestyle uni students partnered inflation like safe enough amount rm rm depending location edit figures based description kind lifestyle chose k ok lah include school events rent utilities enough person aims save reduce cost lets assume person aims eat average x outside xat hostelhome food alone would riggit laptop phone bills need new laptop phone duration study average ringgit years entertainmentother expenses transport varies alot hostel included somewhere close sharing students kl anywhere per room,Neutral,0.47497937083244324,Neutral,0.5300359129905701,Neutral,0.5213241577148438,Neutral,0.4993136525154114,Neutral,0.5088679790496826,foodpanda
authorities investigate truth allegations food panda firm actions must taken protect gig workers victimised irresponsible employers suprised foodpanda still survive fp user use addon fp app cany anyone summarize whats video deleted someone please translate said might put input father work grab rider even shit technology still get money tho edit got info terrible sad heard payment really cucked customer cancel order hope get better job soon hate foodpanda found lalamove best go research tell father increase income feel sadness trembling voice atrocious especially festival season hope pro bono lawyers came forward sue company understand need save money truth discounts subsidised someone else could foodpandas shareholders foodpanda vendors andor riders highly doubt investors still want continue plough money foodpanda since already maturing company cash infusion foodpanda judicious working capital cannot simply throw prices like used three four years ago vendors expressed discontent foodpanda hidden charges lack transparency payments commissions paid foodpanda also already high making margins razorthin food prices cheap may economical vendors sell food drinks foodpanda many desperate sales many competition feel use food delivery service would fair pay bit extra logically speaking middleman needs make money also cost deliver food getting convenience food delivered doorstep premium convenience always questioned viability ecommerce platforms throw discounts like crazy make consumers expect cheap prices continue forever money burned process riders pays continue suppressed often get subpar services nowin scenario everyone long term shitty company shitty policies trouble customer rider time youth realize reality full time gig workers doesnt guarantee stable income also curbing progress better spend time learning handy skill better prospect generating income current delivery market oversaturated longer profitable used mco time end gig jobs supplement income main job edit downvote known gig jobs long term feasible understand plight certainly stand matter want highlight fact alarming number youths decided work gig jobs graduating high school thought pay better conventional jobs dont diploma degree want youth know better path like skilling way better income staying dead end job like one friends delivery told best lalamove last time said people need get money platform asap receiving payment heavily downvoted delivery rider sg work big players yes many riders customers manipulate app policies fraud detection best work progress got suspended couple times raise dispute ticket suspended ply trade apps time disputes resolved favour working days ways escalate cases well feel team managing riders fp highly motivated perform several activities engage riders compared others feel way resolve amicably perhaps way managed different sg,Negative,0.9152669906616211,Negative,0.8979454040527344,Negative,0.9192984700202942,Negative,0.903896152973175,Negative,0.9183592796325684,foodpanda
foodpanda integrates tng ewallets payment method,Neutral,0.8044559359550476,Neutral,0.5693973302841187,Positive,0.6539151668548584,Neutral,0.8474283218383789,Neutral,0.860262930393219,foodpanda
foodpanda malaysia gotten new low got free delivery panda pro get free delivery order rm dont panda pro kfc probably gives free delivery usually restaurant would pink message top stating much need pay get free delivery usually ringgit make sure update app ensure message appears btw note free delivery applies delivery fees restaurant still charge extra fees bait tag state free delivery alot shops u need panda pro actually use shit thing even panda pro still minimum spend order get free delivery think bigger news kfc become expensive nandos quarter chicken set used years back kfc become utter shit last checked back late delivery fees aside note store price scummy time base price jacked along hidden charges packaging shocked today ordering spade burger set cost rm bucks compared spades website price grab bucks expensive reported consumer body grab thr shit right misspelled supposed say fee delivery gotta pump numbers usually rm minimum get free del need normalize reading tc real world dangerous place food delivery luxury shouldnt priced otherwise goes ehailing dont want pay extra dont get delivery easy see investor money dwindled,Negative,0.9821895360946655,Negative,0.9501121044158936,Negative,0.9817168116569519,Negative,0.978046178817749,Negative,0.9692679643630981,foodpanda
scammers jokes im poor bank dont money basically supposed work foodpanda grab etc send message ws ckp already sent suh clicked link confirm world wonder able acquired peoples data easily security supposedly,Negative,0.8768408894538879,Negative,0.8480552434921265,Negative,0.9326395988464355,Negative,0.8207960724830627,Negative,0.8646510243415833,foodpanda
