original_text,delivery time_sentiment,delivery time_score,app experience_sentiment,app experience_score,food quality_sentiment,food quality_score,correctness of order_sentiment,correctness of order_score,price_sentiment,price_score,related_ofd
etunai rakyat primer may read announcement government selected touch n go boost grab ewallets selected etunai rakyat initiative basically budget government give every malaysian age earning rm year oneoff rm initiative use ewallets january march im big advocate ewallets thus im writing post encourage people grab rm money government mean doesnt like get money government ewallets ewallets work like physical wallets earn money withdraw put walletewallet spend unlike physicalfiat money though wont end one day opening wallet seeing rm wondering went every single sen spent tracked shop better monitor spending also safer lose physical wallet thief stole money spend anywhere like hard trace ewallet malaysia requires pin biometric unlocking used thieves cant use even lose phone account balance tied phone number get replacement phone balance still also bank negara malaysian government pushing ewallets digital currency traced merchants ewallet users must registered hard play hanky panky kind money compared fiat money come anywhere spent anything without authorities knowing get rm first choose ewallet options touch n go boost grabpay briefly go differences process registering get rm download app smartphone register phone number get confirmation account additional security requirement must upgrade account premier one boost grab key ic number three apps also require take selfie guess verification purposes ic linked ewallet apply etunai rakyat program begin th january system crosscheck data see youve applied give rm havent thats spend rm registered merchants find logo theyll scan code scan code money exchange hands want topupwithdraw money ewallet use online banking link credit card debit card source touch n go faq differences touch n go boost grab ewallets three companies different perks encourage use use boost grab lot havent used touch n go thus may miss key data able give broad generalisations ewallet boost used give guaranteed cashback every use buy lunch pay using boost every transaction used give rm rm every time random theyve removed past month converted boost coins used cashbacks fun boost generally gameshowy encourages spend coins entries competitions win car something also really banking using boost money spend mobile topups purchases give lots boost coins generally use boost restaurants food stalls like get stuffd lunch drink tealive pay using boost also first time upgrade boost account get rm cashback incentive grabpay straightforward every spend gives points spend vouchers cashback grab links directly grabcar grabfood grab delivery grab mart use features regularly deducts directly ewallet pay services grab points generally used discounts next purchase like rm next ride rm next order least familiar touch n go ewallet installing using buy rm starbucks id say promotion works differently doesnt points encourage spend selected vendors give discounts also anecdotally think lot vendors touch n go signs compared boost grab touch n go ewallet touch n go card unfortunately share name company different things linked link one touch n go physical card know many people one included touch n go ewallet cannot topup physical card using ewallet however directly link physical card directly ewallet tap card toll parking deduct ewallet balance instead card used feature may wrong ive rambling long enough thank reading happy getting rm spend ill happy answer questions may ill answer best abilities however directly link physical card directly ewallet tap card toll parking deduct ewallet balance instead card used feature may wrong unfortunately works selected tolls honestly use tng ewallet due speed launchtopup scan also rfid paydirect works directly app making reloading breeze without service charges rm per ticket tgv really helps budget going movies also cashbacks promos downside cant use paydirect plus highway heard next year different cant top physical tng card mean cmon singapore use nfc mit topup autopass card need app seamlessly cant tried using boost early wasnt stable took launchtopup scan etc downtime dont use grabpay theres incentive thanks sharing post op earn k year would ewallet verify lhdn sign app reason use tng rfidpay direct toll go every day work arent many incentives reload process almost instant yet try boost didnt like cant transfer money account sure thats changed recently grabpay doesnt seem accepted everywhere yet nice see moving towards cashless society use touch n go ewallet daily basis hardly carry cash anywhere go dont like idea withdrawing money atm carry wallet rm spending habit changed tremendously eat place accept ewalletcard payment make withdrawals decide go somewhere require cash boost reverted policies changing cashback coins really making wana uninstal app got rm blue mean postpone thought touch go presented company additional problem used blindly allow sales service team claim tng receipt itemize spending restrict toll parking want use app one dude claimed k via tng found use e wallet makan tbh unify tng card tng ewallet saves much trouble im heavy user rfidtng paydirect ill definitely choose tng ewallet cus doesnt like free tolls,Negative,0.6832398176193237,Negative,0.6817494630813599,Negative,0.6827419996261597,Negative,0.6853556632995605,Negative,0.6876227855682373,grabfood
sign times dedicated parking bay grabfood foodpanda waiting either grempit parking anywhere anyways alphard vellfire euro driver park grab spot good idea imo gotta stay trend block two em cone board apa nama tempat ni mmm menara alpha thatsa good idea excuse deliver floor takde parking la bos hey fellow wangsa majurian ye grabbin spot imma grab mrpunchable,Positive,0.9611533284187317,Positive,0.960527241230011,Positive,0.9624701738357544,Positive,0.9634369611740112,Positive,0.9603958129882812,foodpanda
malaysian shares studied years phd cant find job delivers grabfood independent tldr want comment taking phd sake getting job please dont phds platform make discoveries find breakthroughs whatever field youre taking get degree get money xp get masters phd dont like saying learn code anything man phd bioprocessing theres like tonnes startups malaysia looking guy enter intern field progress thats secure jobs especially startup industry also make ends meet studying phd id rather part time masters pursue phd working know niche bioprocessing probably chose wrong field study talked one colleagues similar situation degree niche field think biochemist sure told either move another country researcher die trying find job related field malaysia back look job chooses grabfood delivery driver find job earns sure lot jobs earn grabfood delivery driver requires diploma doesnt matter field question kind phd takes years long wondering working grab food actually support people actively job searching teach diploma level students end semesters provide tips tricks survive real world one manage job search working recommend gig based jobs never know next interview gig based jobs allows freedom job seekers go interviews compared working permanent job fixed time table worry missed opportunities course type gig jobs offers benefits carries risks accidents flat treys etc job seeker needs good flow income well job hunting time grab car grab food much suitable users often report submissions site ask us ban sensationalised articles rmalaysia oppose blanket banning news source readers responsibility skeptical check sources comment flaws help improve thread linking media verifies questions articles claims link could help readers better understand issue find evidence article title false misleading contact moderators review bot action performed automatically please contact moderators subredditmessagecomposetormalaysia questions concerns relate might need look elsewhere outside malaysia want stay within field switch different field dont worry shares goes viral course kena offer kerja zaman viral lah suggest every jobless people pretty sure public private uni accept mentor lecturer phd even tried nobody put gun head study years phd age already working decade,Negative,0.8240867257118225,Negative,0.6798761487007141,Negative,0.6981034278869629,Negative,0.6349853873252869,Negative,0.7196286916732788,grabfood
abangkakak poslaju grabfood foodpanda funniestscariestsaddest memories job grabcar passenger driver old man pm drive super slow said slow passengers often cancel ride hes way pick passenger honest yes realllyyyy slow chitchat bit told ahole run without paying drive ampm everyday earn enough survive even told study hard respect parents supaya jadi seorang yang berjaya jangan macam saya sekarang hidup susah thought im highschool student haha minutes ride feels like forever gave rm hopped noticed called grabcar apps want return balance rejected hope hes okay idk grabcar included story share passenger guy dropping another passenger picked got car said got grope previous passenger passenger guy person forced poor guy told report grab said grab might anything told report police think report grab hope went report police dropped saw one video ig betina wearing towel delivery man came pretend go take money handing money towel drop delivwryman got shocked quickly paiseh walk away got pizza free stop recording video malaysia poslaju story ordering dildo girlfnd packaging worst ever didnt even box like plasticwrapped holding poslaju package like feel balls shape delivery dude gave ooo youre kinky fella yaaa look bruh embarrassed damnn dat wholesome user name seems suspicious though share link educational purpose instructions unclear balai naked waiting statement taken rpizzadare hmmmmmm,Negative,0.8434441685676575,Negative,0.7119086980819702,Negative,0.8101494908332825,Negative,0.8101839423179626,Negative,0.8317188024520874,foodpanda
psa price difference foodpanda grabfood screencap today grabfood may attractive subscription plans promos ultimately price hike much promo codes consider comparing prices grabfood likely higher approx consistent across three vendors ive personally ordered research well sometimes even promo codes foodpanda comes cheaper grabfood also commonly minimum consider foodpanda often take one dont blindly attracted promos always cheaper shopback account foodpanda eligible cash back well used grabfood currently voucher code rather good easyeats thanks ukuzasasuke tip promo gone food panda go tldr vouchers avoid grabfood cost thats prefer standard fast food delivery grabfoods item price higher foodpandas total never used grabfood looks like never would difference brown sugar warm pearls foodpanda order truncated didnt know one drink cost full dinner kfc two one provides better service never used either one good know thanks share yeahhh grabfood pricier dont prefer use foodpanda tealive recently increase pricing grabfood unknown reason maybe commission percent set grab cause increase pricing always use grabfood also gain reward point used buy deals either grabcar brands tried fun fun designated driver ignored order rode home,Negative,0.967380166053772,Negative,0.9523224234580994,Negative,0.9601311087608337,Negative,0.951904833316803,Negative,0.9636037349700928,foodpanda
people singapore malaysia indonesia order cups bubble tea per month grabfood says grabfood users singapore malaysia indonesia ordered average three cups bubble tea per month users thailand ordered double six cups month oofill honest im closer thailands average malaysias think friends average someone thailand none dont understand hype even good tell teh c cant beat yes dont get chew shit fuck aint paying close rm days essentially diabetes cup want diabetes get less rm thank much product lazadashopee test ur blood sugar mean year start claiming bubble tea ehmaigerdle diabetes lets keep way less title make sound like order bubble tea dont even remember care mind share blood glucose level,Negative,0.8810445070266724,Negative,0.822655975818634,Negative,0.876932680606842,Negative,0.8193784952163696,Negative,0.865000307559967,grabfood
good food delivery services foodpanda im visiting kuala lumpur enjoy getting take away night sometimes foodpanda always hits payment failed please try never ever works others tried grabfood wont let pay cashcard use paypal really depends would like order fast food usually call mcdelivery ie mcdonalds youd like try services theres honestbee running man know local friends ask favour tapau ie takeaway theres dahmakan accept cash cards online banking paypal enjoy stay food activated card present payments bank foodpanda allows pay cash dont think food delivery services use cash need get card work overseas ive actually able order via foodpanda days working haha cash difficult sure thanks though going call bank cant food stress wow didnt know foodpanda accept cash malaysia imagine hassle food panda well delivery man well guess benefits outweigh drawbacks,Positive,0.9046016335487366,Positive,0.9284809231758118,Positive,0.8997625708580017,Positive,0.9217756986618042,Positive,0.9052034020423889,foodpanda
mcdonalds partnering grabfood themselve already delivery sercive perks order mcdonalds grab rather mcdelivery moreover currently grabfood arent available lot area yet curious malaccan since dont grabfood yet whats difference delivery fees platform edit typo youve tried mcdeliveryu know sucks gave worst app ever delivery times wayyy long mcdelivery cant deliver ice cream grabfood also questions motivation mcd delivery staffs customer im loving grab order anytime mcds system time get error arent accepting orders etc bright side grabfood discounts like current promo feast get enjoy ordering mcdonalds increase fleet size grabfood millions customer base course people likely use grabfood order mc delivery free thats currently sg guess similar mcdelivery much shit money refunded month failed delivery mention fight ever dealt refunded money grab smooth dont even need search contact centre explain situation service shouldve double check title posting bad used simpler times lucky mins gaodim shitty website app always good order day ahead enjoy peace mind always face issue unavailable deliver moment pure bs theres perk us theres benefit mcd mcd course want every platform visibility chance purchase people browse grabfood nothing like available might go fuck order mcd theres always potential sale every platform hence mcd grabfood foodpanda wont affect either way neither mcd grab going deliver location,Negative,0.7372307777404785,Positive,0.5126092433929443,Negative,0.5960922241210938,Negative,0.5306987762451172,Negative,0.6440479755401611,foodpanda
grabfood tips case hujan pm ordered food grabfood gf due pm rm rm promo code free delivery pm rain starts pm food hasnt moved yet restaurant says food ready rider call grabs hotline say theres rider active area try manually locate one call back pm call back call grabexpress ge transport thing grab app immediately get one rm delivery pm ge rider goes pick food restaurant pm gf emailssmses say money refunded food cannot sent cant get rider mins refund restaurant food pm ge rider arrives food got food free paid rm delivery told grab said fine save riderless gf order using ge apply food panda food deliveries delivery service downside ate almost hours case wrong delivery friend mine order fulfilled time sent wrong drink instead ordered coke shows gf app got sprite instead theres way rate food order complain restaurant rate gf delivery immediately sent complaint grab app within hour refunded rm deem wrong get partially refunded order wrongly fulfilled expecting tips ordering using grabfood found cases complaints instead runethicallifeprotips friend cheated foodpanda sent voucherfirst time user friend friend use first time user code restaurant cancel order items available however first time coupon considered used dont give coupon replacement friend account considered first time use anymore food panda penipu scammer case save dinner delivered instead burn restaurant case get refund many people let slip right claim ordered sharing tips use apps better scam people use code without issue issue friend take fp used grabfood time jakarta hanoi manila work fine without issue food gets delivered ontime right orders maybe places used service culture due real tourismcentric cities seems like hitandmiss different countries localities already bodoh food panda cs says code already used replacement cant shit yeah food panda penipu scammer grab gojek lot better indonesia malaysia grab sucks shit comparison wow got foodpanda rider cs plotek downvote lol later give nasty rating google playstore foodpanda try downvote grab food grab,Negative,0.9402936697006226,Negative,0.9092491269111633,Negative,0.9348878264427185,Negative,0.9197551012039185,Negative,0.9325429201126099,foodpanda
issues grabfood enraged recent events grabfood would like share issues ongoing makes angry simple issues easy solve please note regular customer multiple orders week sometimes daily spending fair amount money service quite shameful grab deteriorated quality service ever since uber decided forgo services buy grab shares list reasons grab utter shit even compared foodpanda appsystem error times ive ordered put screen process tracking page waiting whole order process updated nothing updated upon refreshing app get notified order could placedrestaurant available need refresh app like tracking page sometimes already heading restaurant suddenly cuts orders timer update without input ive also orders stuck order received long time suddenly food arrives multiple orders restaurant sometimes ive misordered restaurant resulted ordering twice said restaurant dont know grab cant offer restaurant group order one within certain timeframe instead making orders customer pay delivery charges paying delivery charges issue makes worse fact orders delivery people seems like waste time customers sometimes one drivers need stop someones house drop order take additional mins waste customers time also uses additional driver driver could taking delivery different area instead lack customer support cant remember grab used able inapp chat customer support like food pandauber eats remember button call straight grab customer support try sort orders cancel nowadays function way contact customer support app alone try use app link faq crap basically tell contact driver food order status think customers drivers responsibility call restaurants find whats happening regarding order go grabfood facebook find number call customer support even direct website couldnt find anything relating contact info dont know grab trying limit costs making hard customers contact support thus less refunds orders reducing customer support people general customer support service industry super important keeping customers notified happy super fail grab rating system find literally use rating drivers restaurants literally check restaurant listings restaurants listed ratings people small number people rating restaurant seems like every time rate order doesnt seem update system thought type info would useful customers since filter restaurants based rating seems grab doesnt really care food type classification one easiest things right dont understand difficult classify food properly whats use search food type function food typing wrong classified filter food pricing filter food pricing also correct example ie choose cheap pricing get sticky wicket pub medium pricing food threshold least define ranges pricing phantom restaurants sometimes theres restaurants appear list either open dont food inside list restaurant unable restaurants active sort food listed cluttering list loading restaurant list dont know since couple weeks back every time try refreshload restaurant list time load slow sometimes trying load lag app seems issue happens iphones since friends use android dont seem face limit previous order history app seems order limit previous order history reason people need claim meal expenses pay back friend previous order verify statements even check food ordered particular restaurant past orders theyre shit luck contacting facebook ask could email directly months order history exact reply orders stored system long period time history see app access reply email please advised currently order history visible last orders however take concern positively highlight higher management future improvement great job grab limit orders tldr things grab need improve rating system work rating system menu item like ubereats need able invite people share payment meals able favourite restaurant meal food maybe group together certain restaurants near group ordering maybe one order basket needed pay slightly extra delivery charge additional standard delivery charge per shopone driver needed classify food properly food type pricing alright experience grabfood foodpanda always always feeling bad food delivery guy especially rains stapledon business line coz synergies expect always preferred startups one thing one thing well happy dahmakan incessant marketing spam tldr judging organization length post rate pissed please one mycar get ass chair go cook something walk around neighborhood buy fast much healthier way even compared foodpanda foodpanda great man thats order whenever rains thats crap option dont order guys dont get paid feel bad give tip something always tip riders least bucks raining delivered time would tip easy solution upvote,Negative,0.9775794148445129,Negative,0.9767760038375854,Negative,0.9777163863182068,Negative,0.9768657684326172,Negative,0.9773119688034058,foodpanda
grabfood riders strike sick fuck makes delivery guy ride km ringgit delivery grab pantatness never berpisah give tips rider id give grabfood riders extra ringgit would travel meters outside zone deliver place meters pizzahut mcdonalds kfcnobody deliver dont get malays poyo nick names facebook though mcd pn closed eh mcdonalds got delivery service thoz malais suka je taip lyk dis ammi rite conclusion theyre creative bunch grab askar pantat cant understand whatsapp bm words meant cut short,Negative,0.9635481834411621,Negative,0.928204357624054,Negative,0.9623832702636719,Negative,0.950147271156311,Negative,0.9509260058403015,grabfood
delivery app riders malaysia app grabfood foodpanda etc best work im uni student wondering working apps would good way making money part time personal motorcycle thought would good way make money still keeping schedule flexible try gogetmy delivery flexible variety jobs delivery oddjobs colleague work oart time food panda bucks per hour bucks delivery tak tau la berbaloi ke tak told youre insured something bad happen youre man proceeded shoe two separate horrid accidents involving foodpanda riders dont know much alternatives safety wise foodpanda bit risky awareness uninsured motorist,Negative,0.4212498068809509,Positive,0.4207236170768738,Positive,0.4818798005580902,Positive,0.5509365797042847,Neutral,0.39171409606933594,foodpanda
foodpanda vs grab vs shopeefood using shopeefood wanna buy short range vendor due delivery voucher normally spend rm lunch dinner pros need spend rm delivery voucher cons delivery voucher insufficient cover far vendor delivery fee foodpanda wanna buy short medium range vendor delivery voucher panda pro voucher average spending rm lunch dinner pandapro voucher rm unlimited rm x voucher x cons sometimes hour delivery time free delivery spend rm grab panda grabfood pro used suck zero food voucher give rm voucher orders rm average spending around rm lunch dinner grab voucher limited rm x cons limited voucher grabfood pro delivery discount insufficient cover far vendor delivery fee idk name grab food unlimited voucher limited,Negative,0.791804313659668,Neutral,0.7753902673721313,Negative,0.6536463499069214,Negative,0.4592857360839844,Negative,0.4983270764350891,foodpanda
shopee food mcdonald voucher like surely customer gullible enough believe rm discount voucher minimum spending rm capped discount rm thats voucher including delivery fee service tax charges considered scam even though dont know many people going fall unethical misleading least minimum spending rm cap discount rm marketing department getting paid ive seen worse shopee capped rm put tax lol dont focus shopee art words toxicated everywhere ecomm wondering use shopee lazada one better egregious one remember capped rm min spend rm illegal bait waterfish wanna know consumer protection department paid lol good could stack vouchers atleast thats honest isnt,Negative,0.9580114483833313,Negative,0.9265912771224976,Negative,0.9468747973442078,Negative,0.9288811087608337,Negative,0.9581369757652283,shopeefood
